--------[ EVEREST Home Edition (c) 2003-2005 Lavalys, Inc. ]------------------------------------------------------------

    Version                                           EVEREST v2.01.347
    Homepage                                          http://www.lavalys.com/
    Report Type                                       Quick Report
    Computer                                          BOJANR
    Generator                                         Administrator
    Operating System                                  Microsoft Windows 2000 Professional 5.0.2195 (Win2000 Retail)
    Date                                              2005-10-23
    Time                                              17:13


--------[ Summary ]-----------------------------------------------------------------------------------------------------

    Computer:
      Operating System                                  Microsoft Windows 2000 Professional
      OS Service Pack                                   Service Pack 4
      DirectX                                           4.09.00.0904 (DirectX 9.0c)
      Computer Name                                     BOJANR
      User Name                                         Administrator

    Motherboard:
      CPU Type                                          Intel Celeron D 335, 2800 MHz (21 x 133)
      Motherboard Name                                  Gigabyte GA-8I915P Duo  (3 PCI, 2 PCI-E x1, 1 PCI-E x16, 2 DDR DIMM, 2 DDR2 DIMM, Audio, Gigabit LAN)
      Motherboard Chipset                               Intel Grantsdale i915P
      System Memory                                     512 MB  (PC3200 DDR SDRAM)
      BIOS Type                                         Award Modular (01/21/05)
      Communication Port                                Communications Port (COM1)
      Communication Port                                Printer Port (LPT1)

    Display:
      Video Adapter                                     NVIDIA GeForce 6600  (128 MB)
      3D Accelerator                                    nVIDIA GeForce 6600 PCI-E
      Monitor                                           Daewoo 511B  [15" CRT]

    Multimedia:
      Audio Adapter                                     Intel 82801FB ICH6 - High Definition Audio Controller [B-1]

    Storage:
      IDE Controller                                    Intel(R) 82801FB/FBM Ultra ATA Storage Controllers - 266F
      SCSI/RAID Controller                              ST3SHARK SCSI Controller
      SCSI/RAID Controller                              VIA VT6410 RAID Controller
      Floppy Drive                                      Floppy disk drive
      Disk Drive                                        QUANTUM FIREBALLlct20 20  (19 GB, 4500 RPM, Ultra-ATA/100)
      Disk Drive                                        HDS72251 6VLAT80 SCSI Disk Device  (160 GB, 7200 RPM, Ultra-ATA/100)
      Optical Drive                                     Generic DVD-ROM SCSI CdRom Device
      Optical Drive                                     PIONEER DVD-RW  DVR-109  (DVD+R9:6x, DVD-R9:6x, DVD+RW:16x/8x, DVD-RW:16x/6x, DVD-ROM:16x, CD:40x/24x/40x DVD+RW/DVD-RW)
      SMART Hard Disks Status                           OK

    Partitions:
      C: (NTFS)                                         5106 MB (2857 MB free)
      D: (NTFS)                                         151950 MB (108596 MB free)
      G: (FAT32)                                        5358 MB (5340 MB free)
      Total Size                                        158.6 GB (114.1 GB free)

    Input:
      Keyboard                                          Standard 101/102-Key or Microsoft Natural PS/2 Keyboard
      Mouse                                             PS/2 Compatible Mouse

    Network:
      Modem                                             Generic SoftK56 Data Fax

    Peripherals:
      Printer                                           Fax
      USB1 Controller                                   Intel 82801FB ICH6 - USB Universal Host Controller [B-1]
      USB1 Controller                                   Intel 82801FB ICH6 - USB Universal Host Controller [B-1]
      USB1 Controller                                   Intel 82801FB ICH6 - USB Universal Host Controller [B-1]
      USB1 Controller                                   Intel 82801FB ICH6 - USB Universal Host Controller [B-1]
      USB2 Controller                                   Intel 82801FB ICH6 - Enhanced USB2 Controller [B-1]


--------[ Debug - PCI ]-------------------------------------------------------------------------------------------------

    B00 D00 F00:  Intel 82910GL/915G/915GL/915GV/915P/915PL Memory Controller Hub [B-1]
                  
      Offset 00:  86 80 80 25  06 00 90 20  04 00 00 06  00 00 00 00 
      Offset 10:  00 00 00 00  00 00 00 00  00 00 00 00  00 00 00 00 
      Offset 20:  00 00 00 00  00 00 00 00  00 00 00 00  58 14 80 25 
      Offset 30:  00 00 00 00  E0 00 00 00  00 00 00 00  00 00 00 00 
      Offset 40:  00 90 D1 FE  00 40 D1 FE  00 00 00 D0  00 80 D1 FE 
      Offset 50:  00 00 02 00  03 00 00 B8  00 00 00 00  00 00 00 00 
      Offset 60:  01 30 D1 FE  00 00 00 00  00 00 00 00  00 00 00 00 
      Offset 70:  00 00 00 00  00 00 00 00  00 00 00 00  00 00 00 00 
      Offset 80:  00 00 00 00  00 00 00 00  00 00 00 00  00 00 00 00 
      Offset 90:  10 11 11 01  00 00 00 00  00 00 00 00  20 0A 38 00 
      Offset A0:  00 00 00 00  00 00 00 00  00 00 00 00  00 00 00 00 
      Offset B0:  00 00 00 00  00 00 00 00  00 00 00 00  00 00 00 00 
      Offset C0:  00 00 00 00  00 00 00 00  00 00 00 00  00 00 00 00 
      Offset D0:  00 00 00 00  00 00 00 00  00 00 00 00  40 01 00 00 
      Offset E0:  09 00 09 21  42 B3 9B 88  02 00 00 00  00 00 00 00 
      Offset F0:  00 00 00 00  00 00 00 00  00 00 05 00  00 00 00 00 

    B00 D01 F00:  Intel 82910GL/915G/915GL/915GV/915P/915PL PCI Express Root Port
                  
      Offset 00:  86 80 81 25  07 00 10 00  04 00 04 06  08 00 01 00 
      Offset 10:  00 00 00 00  00 00 00 00  00 01 01 00  F0 00 00 20 
      Offset 20:  00 E0 F0 EF  F0 FF 00 00  00 00 00 00  00 00 00 00 
      Offset 30:  00 00 00 00  88 00 00 00  00 00 00 00  10 01 0C 00 
      Offset 40:  00 00 00 00  00 00 00 00  00 00 00 00  00 00 00 00 
      Offset 50:  00 00 00 00  00 00 00 00  00 00 00 00  00 00 00 00 
      Offset 60:  00 00 00 00  00 00 00 00  00 00 00 00  00 00 00 00 
      Offset 70:  00 00 00 00  00 00 00 00  00 00 00 00  00 00 00 02 
      Offset 80:  01 90 02 C8  00 00 00 00  0D 80 00 00  86 80 00 00 
      Offset 90:  05 A0 00 00  00 00 00 00  00 00 00 00  00 00 00 00 
      Offset A0:  10 00 41 01  00 00 00 00  00 00 00 00  01 45 01 02 
      Offset B0:  40 00 01 11  80 25 00 01  C0 01 48 00  00 00 00 00 
      Offset C0:  00 00 00 00  00 00 00 00  00 00 00 00  00 00 00 00 
      Offset D0:  00 00 00 00  00 00 00 00  00 00 00 00  00 00 00 00 
      Offset E0:  00 00 00 00  00 00 00 00  00 00 00 00  00 00 00 00 
      Offset F0:  00 00 01 00  00 00 00 00  00 00 05 00  00 00 00 00 

    B00 D1B F00:  Intel 82801FB ICH6 - High Definition Audio Controller [B-1]
                  
      Offset 00:  86 80 68 26  06 00 10 00  03 00 03 04  08 00 00 00 
      Offset 10:  04 00 20 F0  00 00 00 00  00 00 00 00  00 00 00 00 
      Offset 20:  00 00 00 00  00 00 00 00  00 00 00 00  58 14 05 A0 
      Offset 30:  00 00 00 00  50 00 00 00  00 00 00 00  10 01 00 00 
      Offset 40:  01 00 00 00  07 00 00 00  00 00 00 00  00 00 00 00 
      Offset 50:  01 60 42 C8  00 00 00 00  00 00 00 00  00 00 00 00 
      Offset 60:  05 70 80 00  00 00 00 00  00 00 00 00  00 00 00 00 
      Offset 70:  10 00 91 00  00 00 00 00  00 08 10 00  00 00 00 00 
      Offset 80:  00 00 00 00  00 00 00 00  00 00 00 00  00 00 00 00 
      Offset 90:  00 00 00 00  00 00 00 00  00 00 00 00  00 00 00 00 
      Offset A0:  00 00 00 00  00 00 00 00  00 00 00 00  00 00 00 00 
      Offset B0:  00 00 00 00  00 00 00 00  00 00 00 00  00 00 00 00 
      Offset C0:  00 00 00 01  00 00 00 00  00 00 00 00  00 00 00 00 
      Offset D0:  00 00 00 00  00 00 00 00  00 00 00 00  00 00 00 00 
      Offset E0:  00 00 00 00  00 00 00 00  00 00 00 00  00 00 00 00 
      Offset F0:  00 00 00 00  00 00 00 00  80 0F 03 00  00 00 00 00 

    B00 D1C F00:  Intel 82801FB ICH6 - PCI Express Port 1 [B-1]
                  
      Offset 00:  86 80 60 26  07 00 10 00  03 00 04 06  08 00 81 00 
      Offset 10:  00 00 00 00  00 00 00 00  00 02 02 00  90 90 00 20 
      Offset 20:  F0 FF 00 00  F1 FF 01 00  00 00 00 00  00 00 00 00 
      Offset 30:  00 00 00 00  40 00 00 00  00 00 00 00  10 01 04 00 
      Offset 40:  10 80 41 01  E0 0F 00 00  00 00 10 00  11 4C 01 01 
      Offset 50:  00 00 01 10  60 05 80 00  00 00 00 00  00 00 00 00 
      Offset 60:  00 00 00 00  00 00 00 00  00 00 00 00  00 00 00 00 
      Offset 70:  00 00 00 00  00 00 00 00  00 00 00 00  00 00 00 00 
      Offset 80:  05 90 00 00  00 00 00 00  00 00 00 00  00 00 00 00 
      Offset 90:  0D A0 00 00  00 00 00 00  00 00 00 00  00 00 00 00 
      Offset A0:  01 00 02 C8  00 00 00 00  00 00 00 00  00 00 00 00 
      Offset B0:  00 00 00 00  00 00 00 00  00 00 00 00  00 00 00 00 
      Offset C0:  00 00 00 00  00 00 00 00  00 00 00 00  00 00 00 00 
      Offset D0:  00 00 00 00  00 00 00 00  00 00 11 00  00 00 00 00 
      Offset E0:  00 00 00 00  00 00 00 00  00 00 00 00  00 00 00 00 
      Offset F0:  00 00 00 00  00 00 00 00  80 0F 03 00  00 00 00 00 

    B00 D1C F02:  Intel 82801FB ICH6 - PCI Express Port 3 [B-1]
                  
      Offset 00:  86 80 64 26  07 00 10 00  03 00 04 06  08 00 81 00 
      Offset 10:  00 00 00 00  00 00 00 00  00 03 03 00  F0 00 00 20 
      Offset 20:  00 F0 00 F0  F1 FF 01 00  00 00 00 00  00 00 00 00 
      Offset 30:  00 00 00 00  40 00 00 00  00 00 00 00  12 03 04 00 
      Offset 40:  10 80 41 01  E0 0F 00 00  00 00 11 00  11 4C 01 03 
      Offset 50:  00 00 11 10  60 05 90 00  00 00 48 00  00 00 00 00 
      Offset 60:  00 00 00 00  00 00 00 00  00 00 00 00  00 00 00 00 
      Offset 70:  00 00 00 00  00 00 00 00  00 00 00 00  00 00 00 00 
      Offset 80:  05 90 00 00  00 00 00 00  00 00 00 00  00 00 00 00 
      Offset 90:  0D A0 00 00  00 00 00 00  00 00 00 00  00 00 00 00 
      Offset A0:  01 00 02 C8  00 00 00 00  00 00 00 00  00 00 00 00 
      Offset B0:  00 00 00 00  00 00 00 00  00 00 00 00  00 00 00 00 
      Offset C0:  00 00 00 00  00 00 00 00  00 00 00 00  00 00 00 00 
      Offset D0:  00 00 00 00  00 00 00 00  00 00 11 00  00 00 00 00 
      Offset E0:  01 00 00 00  00 00 00 00  00 00 00 00  00 00 00 00 
      Offset F0:  00 00 00 00  00 00 00 00  80 0F 03 00  00 00 00 00 

    B00 D1D F00:  Intel 82801FB ICH6 - USB Universal Host Controller [B-1]
                  
      Offset 00:  86 80 58 26  05 00 80 02  03 00 03 0C  00 00 80 00 
      Offset 10:  00 00 00 00  00 00 00 00  00 00 00 00  00 00 00 00 
      Offset 20:  01 CC 00 00  00 00 00 00  00 00 00 00  58 14 58 26 
      Offset 30:  00 00 00 00  00 00 00 00  00 00 00 00  17 01 00 00 
      Offset 40:  00 00 00 00  00 00 00 00  00 00 00 00  00 00 00 00 
      Offset 50:  00 00 00 00  00 00 00 00  00 00 00 00  00 00 00 00 
      Offset 60:  10 00 00 00  00 00 00 00  00 00 00 00  00 00 00 00 
      Offset 70:  00 00 00 00  00 00 00 00  00 00 00 00  00 00 00 00 
      Offset 80:  00 00 00 00  00 00 00 00  00 00 00 00  00 00 00 00 
      Offset 90:  00 00 00 00  00 00 00 00  00 00 00 00  00 00 00 00 
      Offset A0:  00 00 00 00  00 00 00 00  00 00 00 00  00 00 00 00 
      Offset B0:  00 00 00 00  00 00 00 00  00 00 00 00  00 00 00 00 
      Offset C0:  00 2F 00 00  00 00 00 00  00 00 01 00  00 00 00 00 
      Offset D0:  00 00 00 00  00 00 00 00  00 00 00 00  00 00 00 00 
      Offset E0:  00 00 00 00  00 00 00 00  00 00 00 00  00 00 00 00 
      Offset F0:  00 00 00 00  00 00 00 00  80 0F 03 00  00 00 00 00 

    B00 D1D F01:  Intel 82801FB ICH6 - USB Universal Host Controller [B-1]
                  
      Offset 00:  86 80 59 26  05 00 80 02  03 00 03 0C  00 00 00 00 
      Offset 10:  00 00 00 00  00 00 00 00  00 00 00 00  00 00 00 00 
      Offset 20:  01 C0 00 00  00 00 00 00  00 00 00 00  58 14 59 26 
      Offset 30:  00 00 00 00  00 00 00 00  00 00 00 00  13 02 00 00 
      Offset 40:  00 00 00 00  00 00 00 00  00 00 00 00  00 00 00 00 
      Offset 50:  00 00 00 00  00 00 00 00  00 00 00 00  00 00 00 00 
      Offset 60:  10 00 00 00  00 00 00 00  00 00 00 00  00 00 00 00 
      Offset 70:  00 00 00 00  00 00 00 00  00 00 00 00  00 00 00 00 
      Offset 80:  00 00 00 00  00 00 00 00  00 00 00 00  00 00 00 00 
      Offset 90:  00 00 00 00  00 00 00 00  00 00 00 00  00 00 00 00 
      Offset A0:  00 00 00 00  00 00 00 00  00 00 00 00  00 00 00 00 
      Offset B0:  00 00 00 00  00 00 00 00  00 00 00 00  00 00 00 00 
      Offset C0:  00 2F 00 00  00 00 00 00  00 00 01 00  00 00 00 00 
      Offset D0:  00 00 00 00  00 00 00 00  00 00 00 00  00 00 00 00 
      Offset E0:  00 00 00 00  00 00 00 00  00 00 00 00  00 00 00 00 
      Offset F0:  00 00 00 00  00 00 00 00  80 0F 03 00  00 00 00 00 

    B00 D1D F02:  Intel 82801FB ICH6 - USB Universal Host Controller [B-1]
                  
      Offset 00:  86 80 5A 26  05 00 80 02  03 00 03 0C  00 00 00 00 
      Offset 10:  00 00 00 00  00 00 00 00  00 00 00 00  00 00 00 00 
      Offset 20:  01 C4 00 00  00 00 00 00  00 00 00 00  58 14 5A 26 
      Offset 30:  00 00 00 00  00 00 00 00  00 00 00 00  12 03 00 00 
      Offset 40:  00 00 00 00  00 00 00 00  00 00 00 00  00 00 00 00 
      Offset 50:  00 00 00 00  00 00 00 00  00 00 00 00  00 00 00 00 
      Offset 60:  10 00 00 00  00 00 00 00  00 00 00 00  00 00 00 00 
      Offset 70:  00 00 00 00  00 00 00 00  00 00 00 00  00 00 00 00 
      Offset 80:  00 00 00 00  00 00 00 00  00 00 00 00  00 00 00 00 
      Offset 90:  00 00 00 00  00 00 00 00  00 00 00 00  00 00 00 00 
      Offset A0:  00 00 00 00  00 00 00 00  00 00 00 00  00 00 00 00 
      Offset B0:  00 00 00 00  00 00 00 00  00 00 00 00  00 00 00 00 
      Offset C0:  00 2F 00 00  00 00 00 00  00 00 01 00  00 00 00 00 
      Offset D0:  00 00 00 00  00 00 00 00  00 00 00 00  00 00 00 00 
      Offset E0:  00 00 00 00  00 00 00 00  00 00 00 00  00 00 00 00 
      Offset F0:  00 00 00 00  00 00 00 00  80 0F 03 00  00 00 00 00 

    B00 D1D F03:  Intel 82801FB ICH6 - USB Universal Host Controller [B-1]
                  
      Offset 00:  86 80 5B 26  05 00 80 02  03 00 03 0C  00 00 00 00 
      Offset 10:  00 00 00 00  00 00 00 00  00 00 00 00  00 00 00 00 
      Offset 20:  01 C8 00 00  00 00 00 00  00 00 00 00  58 14 5A 26 
      Offset 30:  00 00 00 00  00 00 00 00  00 00 00 00  10 04 00 00 
      Offset 40:  00 00 00 00  00 00 00 00  00 00 00 00  00 00 00 00 
      Offset 50:  00 00 00 00  00 00 00 00  00 00 00 00  00 00 00 00 
      Offset 60:  10 00 00 00  00 00 00 00  00 00 00 00  00 00 00 00 
      Offset 70:  00 00 00 00  00 00 00 00  00 00 00 00  00 00 00 00 
      Offset 80:  00 00 00 00  00 00 00 00  00 00 00 00  00 00 00 00 
      Offset 90:  00 00 00 00  00 00 00 00  00 00 00 00  00 00 00 00 
      Offset A0:  00 00 00 00  00 00 00 00  00 00 00 00  00 00 00 00 
      Offset B0:  00 00 00 00  00 00 00 00  00 00 00 00  00 00 00 00 
      Offset C0:  00 2F 00 00  00 00 00 00  00 00 01 00  00 00 00 00 
      Offset D0:  00 00 00 00  00 00 00 00  00 00 00 00  00 00 00 00 
      Offset E0:  00 00 00 00  00 00 00 00  00 00 00 00  00 00 00 00 
      Offset F0:  00 00 00 00  00 00 00 00  80 0F 03 00  00 00 00 00 

    B00 D1D F07:  Intel 82801FB ICH6 - Enhanced USB2 Controller [B-1]
                  
      Offset 00:  86 80 5C 26  06 00 90 02  03 20 03 0C  00 00 00 00 
      Offset 10:  00 40 20 F0  00 00 00 00  00 00 00 00  00 00 00 00 
      Offset 20:  00 00 00 00  00 00 00 00  00 00 00 00  58 14 06 50 
      Offset 30:  00 00 00 00  50 00 00 00  00 00 00 00  17 01 00 00 
      Offset 40:  00 00 00 00  00 00 00 00  00 00 00 00  00 00 00 00 
      Offset 50:  01 00 02 00  00 00 00 00  0A 00 A0 20  00 00 00 00 
      Offset 60:  20 20 FF 01  00 00 00 00  01 00 00 00  00 00 00 C0 
      Offset 70:  00 00 C5 3F  00 00 00 00  00 00 00 00  00 00 00 00 
      Offset 80:  00 00 00 00  01 00 00 00  00 00 00 00  00 00 00 00 
      Offset 90:  00 00 00 00  00 00 00 00  00 00 00 00  00 00 00 00 
      Offset A0:  00 00 00 00  00 00 00 00  00 00 00 00  00 00 00 00 
      Offset B0:  00 00 00 00  00 00 00 00  00 00 00 00  00 00 00 00 
      Offset C0:  00 00 00 00  00 00 00 00  00 00 00 00  00 00 00 00 
      Offset D0:  00 00 00 00  00 AA FF 00  55 55 FF 00  20 00 00 00 
      Offset E0:  00 00 00 00  00 00 00 00  00 00 00 00  00 00 00 00 
      Offset F0:  00 80 00 09  88 8C 40 00  80 0F 03 00  86 17 00 00 

    B00 D1E F00:  Intel 82801FB I/O Controller Hub 6 (ICH6) [B-1]
                  
      Offset 00:  86 80 4E 24  07 00 10 00  D3 01 04 06  00 00 01 00 
      Offset 10:  00 00 00 00  00 00 00 00  00 04 04 20  A0 B0 80 22 
      Offset 20:  10 F0 10 F0  F1 FF 01 00  00 00 00 00  00 00 00 00 
      Offset 30:  00 00 00 00  50 00 00 00  00 00 00 00  FF 00 04 00 
      Offset 40:  00 00 00 00  00 00 00 00  00 00 00 00  00 00 00 00 
      Offset 50:  0D 00 00 00  00 00 00 00  00 00 00 00  00 00 00 00 
      Offset 60:  00 00 00 00  00 00 00 00  00 00 00 00  00 00 00 00 
      Offset 70:  00 00 00 00  00 00 00 00  00 00 00 00  00 00 00 00 
      Offset 80:  00 00 00 00  00 00 00 00  00 00 00 00  00 00 00 00 
      Offset 90:  00 00 00 00  00 00 00 00  00 00 00 00  00 00 00 00 
      Offset A0:  00 00 00 00  00 00 00 00  00 00 00 00  00 00 00 00 
      Offset B0:  00 00 00 00  00 00 00 00  00 00 00 00  00 00 00 00 
      Offset C0:  00 00 00 00  00 00 00 00  00 00 00 00  00 00 00 00 
      Offset D0:  00 00 00 00  00 00 00 00  00 00 00 00  00 00 00 00 
      Offset E0:  00 00 00 00  00 00 00 00  00 00 00 00  00 00 00 00 
      Offset F0:  00 00 00 00  00 00 00 00  80 0F 03 00  00 00 00 00 

    B00 D1F F00:  Intel 82801FB ICH6 - LPC Bridge [B-1]
                  
      Offset 00:  86 80 40 26  07 01 00 02  03 00 01 06  00 00 80 00 
      Offset 10:  00 00 00 00  00 00 00 00  00 00 00 00  00 00 00 00 
      Offset 20:  00 00 00 00  00 00 00 00  00 00 00 00  00 00 00 00 
      Offset 30:  00 00 00 00  00 00 00 00  00 00 00 00  00 00 00 00 
      Offset 40:  01 04 00 00  80 00 00 00  81 04 00 00  10 00 00 00 
      Offset 50:  00 00 00 00  00 00 00 00  00 00 00 00  00 00 00 00 
      Offset 60:  89 80 85 8B  D0 00 00 00  83 80 8A 8B  00 00 00 00 
      Offset 70:  00 00 00 00  00 00 00 00  00 00 00 00  00 00 00 00 
      Offset 80:  00 00 0C 34  01 08 00 00  91 02 00 00  00 00 00 00 
      Offset 90:  00 00 00 00  00 00 00 00  00 00 00 00  00 00 00 00 
      Offset A0:  20 02 00 00  00 00 00 00  00 00 00 00  00 03 00 00 
      Offset B0:  00 00 00 00  00 00 00 00  55 55 55 59  00 00 00 00 
      Offset C0:  00 00 00 00  00 00 00 00  00 00 00 00  00 00 00 00 
      Offset D0:  33 22 11 00  67 45 00 00  C0 C0 00 00  00 00 00 00 
      Offset E0:  00 00 00 00  00 00 00 00  00 00 00 00  00 00 00 00 
      Offset F0:  01 C0 D1 FE  00 00 00 00  80 0F 03 00  00 00 00 00 

    B00 D1F F01:  Intel 82801FB ICH6 - ATA-100 IDE Controller [B-1]
                  
      Offset 00:  86 80 6F 26  05 00 80 02  03 8A 01 01  00 00 00 00 
      Offset 10:  01 00 00 00  01 00 00 00  01 00 00 00  01 00 00 00 
      Offset 20:  01 F0 00 00  00 00 00 00  00 00 00 00  58 14 6F 26 
      Offset 30:  00 00 00 00  00 00 00 00  00 00 00 00  00 01 00 00 
      Offset 40:  77 E3 00 80  0B 00 00 00  03 00 21 00  00 00 00 00 
      Offset 50:  00 00 00 00  32 10 00 00  00 00 00 00  00 00 00 00 
      Offset 60:  00 00 00 00  00 00 00 00  00 00 00 00  00 00 00 00 
      Offset 70:  00 00 00 00  00 00 00 00  00 00 00 00  00 00 00 00 
      Offset 80:  00 00 00 00  00 00 00 00  00 00 00 00  00 00 00 00 
      Offset 90:  00 00 00 00  00 00 00 00  00 00 00 00  00 00 00 00 
      Offset A0:  00 00 00 00  00 00 00 00  00 00 00 00  00 00 00 00 
      Offset B0:  00 00 00 00  00 00 00 00  00 00 00 00  00 00 00 00 
      Offset C0:  00 00 00 00  03 00 00 00  00 00 00 00  00 00 00 00 
      Offset D0:  00 00 00 00  00 00 00 00  00 00 00 00  00 00 00 00 
      Offset E0:  00 00 00 00  00 00 00 00  00 00 00 00  00 00 00 00 
      Offset F0:  00 00 00 00  00 00 00 00  80 0F 03 00  00 00 00 00 

    B00 D1F F03:  Intel 82801FB ICH6 - SMBus Controller [B-1]
                  
      Offset 00:  86 80 6A 26  01 00 80 02  03 00 05 0C  00 00 00 00 
      Offset 10:  00 00 00 00  00 00 00 00  00 00 00 00  00 00 00 00 
      Offset 20:  01 05 00 00  00 00 00 00  00 00 00 00  58 14 6A 26 
      Offset 30:  00 00 00 00  00 00 00 00  00 00 00 00  0B 02 00 00 
      Offset 40:  01 00 00 00  00 00 00 00  00 00 00 00  00 00 00 00 
      Offset 50:  00 00 00 00  00 00 00 00  00 00 00 00  00 00 00 00 
      Offset 60:  00 00 00 00  00 00 00 00  00 00 00 00  00 00 00 00 
      Offset 70:  00 00 00 00  00 00 00 00  00 00 00 00  00 00 00 00 
      Offset 80:  00 00 00 00  00 00 00 00  00 00 00 00  00 00 00 00 
      Offset 90:  00 00 00 00  00 00 00 00  00 00 00 00  00 00 00 00 
      Offset A0:  00 00 00 00  00 00 00 00  00 00 00 00  00 00 00 00 
      Offset B0:  00 00 00 00  00 00 00 00  00 00 00 00  00 00 00 00 
      Offset C0:  00 00 00 00  00 00 00 00  00 00 00 00  00 00 00 00 
      Offset D0:  00 00 00 00  00 00 00 00  00 00 00 00  00 00 00 00 
      Offset E0:  00 00 00 00  00 00 00 00  00 00 00 00  00 00 00 00 
      Offset F0:  00 00 00 00  00 00 00 00  80 0F 03 00  00 00 00 00 

    B01 D00 F00:  Gigabyte GeForce 6600 PCI-E Video Adapter
                  
      Offset 00:  DE 10 41 01  07 00 10 00  A2 00 00 03  00 00 00 00 
      Offset 10:  00 00 00 E8  0C 00 00 E0  00 00 00 00  04 00 00 EC 
      Offset 20:  00 00 00 00  00 00 00 00  00 00 00 00  58 14 24 31 
      Offset 30:  00 00 00 00  60 00 00 00  00 00 00 00  10 01 00 00 
      Offset 40:  58 14 24 31  00 00 00 00  00 00 00 00  00 00 00 00 
      Offset 50:  01 00 00 00  01 00 00 00  CE D6 23 00  00 00 00 00 
      Offset 60:  01 68 02 00  00 00 00 00  05 78 80 00  00 00 00 00 
      Offset 70:  00 00 00 00  00 00 00 00  10 00 01 00  C0 04 2C 01 
      Offset 80:  10 28 0A 00  01 2D 01 00  48 00 01 01  00 00 00 00 
      Offset 90:  00 00 00 00  00 00 00 00  0C 08 40 C1  01 04 40 C1 
      Offset A0:  00 00 00 00  00 00 00 00  00 00 00 00  00 00 00 00 
      Offset B0:  00 00 00 00  00 00 00 00  00 00 00 00  00 00 00 00 
      Offset C0:  00 00 00 00  00 00 00 00  00 00 00 00  00 00 00 00 
      Offset D0:  00 00 00 00  00 00 00 00  00 00 00 00  00 00 00 00 
      Offset E0:  00 00 00 00  00 00 00 00  00 00 00 00  00 00 00 00 
      Offset F0:  00 00 00 00  00 00 00 00  00 00 00 00  00 00 00 00 

    B03 D00 F00:  Broadcom NetLink (TM) Gigabit Ethernet [NoDB]
                  
      Offset 00:  E4 14 9D 16  00 00 10 00  11 00 00 02  08 00 00 00 
      Offset 10:  04 00 00 F0  00 00 00 00  00 00 00 00  00 00 00 00 
      Offset 20:  00 00 00 00  00 00 00 00  07 00 00 00  58 14 00 E0 
      Offset 30:  00 00 00 00  48 00 00 00  00 00 00 00  05 01 00 00 
      Offset 40:  00 00 00 00  00 00 00 00  01 50 02 C0  03 20 00 64 
      Offset 50:  03 58 00 00  00 01 0A 20  05 D0 86 00  00 4E 20 00 
      Offset 60:  62 E1 17 03  07 0E 00 00  00 00 01 41  00 00 00 00 
      Offset 70:  12 12 00 00  C0 00 00 00  50 00 00 00  00 00 00 00 
      Offset 80:  00 00 00 00  00 00 00 00  00 00 00 00  FE 10 0E 3C 
      Offset 90:  01 02 00 00  00 00 00 00  00 00 00 00  00 00 00 00 
      Offset A0:  00 00 00 00  00 00 00 00  00 00 00 00  00 00 00 00 
      Offset B0:  00 00 00 00  00 00 00 00  00 00 00 00  00 00 00 00 
      Offset C0:  00 00 00 00  00 80 00 00  0E 00 00 00  00 00 00 00 
      Offset D0:  10 00 01 00  A0 0F 28 00  00 20 1A 00  11 54 03 00 
      Offset E0:  00 00 11 10  00 00 00 00  00 00 00 00  00 00 00 00 
      Offset F0:  00 00 00 00  00 00 00 00  00 00 00 00  00 00 00 00 

    B04 D00 F00:  Techsan B2C2 Broadband Receiver Adapter (FCII)
                  
      Offset 00:  D0 13 03 21  07 00 00 04  01 00 80 02  00 20 00 00 
      Offset 10:  00 00 10 F0  01 A0 00 00  00 00 00 00  00 00 00 00 
      Offset 20:  00 00 00 00  00 00 00 00  00 00 00 00  D0 13 03 21 
      Offset 30:  00 00 00 00  00 00 00 00  00 00 00 00  14 01 00 00 
      Offset 40:  00 00 00 00  00 00 00 00  00 00 00 00  00 00 00 00 
      Offset 50:  00 00 00 00  00 00 00 00  00 00 00 00  00 00 00 00 
      Offset 60:  00 00 00 00  00 00 00 00  00 00 00 00  00 00 00 00 
      Offset 70:  00 00 00 00  00 00 00 00  00 00 00 00  00 00 00 00 
      Offset 80:  00 00 00 00  00 00 00 00  00 00 00 00  00 00 00 00 
      Offset 90:  00 00 00 00  00 00 00 00  00 00 00 00  00 00 00 00 
      Offset A0:  00 00 00 00  00 00 00 00  00 00 00 00  00 00 00 00 
      Offset B0:  00 00 00 00  00 00 00 00  00 00 00 00  00 00 00 00 
      Offset C0:  00 00 00 00  00 00 00 00  00 00 00 00  00 00 00 00 
      Offset D0:  00 00 00 00  00 00 00 00  00 00 00 00  00 00 00 00 
      Offset E0:  00 00 00 00  00 00 00 00  00 00 00 00  00 00 00 00 
      Offset F0:  00 00 00 00  00 00 00 00  00 00 00 00  00 00 00 00 

    B04 D01 F00:  Rockwell/Conexant SoftK56 Voice/Data/Fax/SpeakerPhone Modem
                  
      Offset 00:  7A 12 05 20  07 00 90 02  01 00 00 00  00 20 00 00 
      Offset 10:  00 00 11 F0  01 A4 00 00  00 00 00 00  00 00 00 00 
      Offset 20:  00 00 00 00  00 00 00 00  00 00 00 00  7A 12 05 20 
      Offset 30:  00 00 00 00  40 00 00 00  00 00 00 00  13 01 00 00 
      Offset 40:  01 00 32 7E  00 00 00 FF  00 00 00 00  00 00 00 00 
      Offset 50:  00 00 00 00  00 00 00 00  00 00 00 00  00 00 00 00 
      Offset 60:  00 00 00 00  00 00 00 00  00 00 00 00  00 00 00 00 
      Offset 70:  00 00 00 00  00 00 00 00  00 00 00 00  00 00 00 00 
      Offset 80:  00 00 00 00  00 00 00 00  00 00 00 00  00 00 00 00 
      Offset 90:  00 00 00 00  00 00 00 00  00 00 00 00  00 00 00 00 
      Offset A0:  00 00 00 00  00 00 00 00  00 00 00 00  00 00 00 00 
      Offset B0:  00 00 00 00  00 00 00 00  00 00 00 00  00 00 00 00 
      Offset C0:  00 00 00 00  00 00 00 00  00 00 00 00  00 00 00 00 
      Offset D0:  00 00 00 00  00 00 00 00  00 00 00 00  00 00 00 00 
      Offset E0:  00 00 00 00  00 00 00 00  00 00 00 00  00 00 00 00 
      Offset F0:  00 00 00 00  00 00 00 00  00 00 00 00  00 00 00 00 

    B04 D06 F00:  VIA VT6410 IDE RAID Controller
                  
      Offset 00:  06 11 64 31  07 00 90 02  06 00 04 01  00 20 00 00 
      Offset 10:  01 A8 00 00  01 AC 00 00  01 B0 00 00  01 B4 00 00 
      Offset 20:  01 B8 00 00  00 00 00 00  00 00 00 00  06 11 64 31 
      Offset 30:  00 00 00 00  C0 00 00 00  00 00 00 00  16 01 00 00 
      Offset 40:  1B F2 C9 35  10 2D C0 00  A8 A8 A8 20  FF 00 B6 B6 
      Offset 50:  1F 1F 1F F6  14 00 00 00  00 A0 20 00  00 00 00 00 
      Offset 60:  00 02 00 00  00 00 00 00  00 02 00 00  00 00 00 00 
      Offset 70:  02 01 00 00  00 00 00 00  02 01 00 00  00 00 00 00 
      Offset 80:  00 E8 FC 01  00 00 00 00  00 EC FC 01  00 00 00 00 
      Offset 90:  00 00 00 00  00 00 00 00  00 00 00 00  00 00 00 00 
      Offset A0:  00 00 00 00  00 00 00 00  00 00 00 00  00 00 00 00 
      Offset B0:  00 00 00 00  00 00 00 00  00 00 00 00  00 00 00 00 
      Offset C0:  01 00 02 00  00 00 00 00  00 00 00 00  00 00 00 00 
      Offset D0:  06 00 64 31  06 11 64 31  00 00 00 00  00 00 00 00 
      Offset E0:  00 00 00 00  00 00 00 00  00 00 00 00  00 00 00 00 
      Offset F0:  00 00 00 00  00 00 00 00  00 00 00 00  00 00 00 00 

    PCI-8086-2580:  Intel i915/925/945/955/E7221/E7230 MMR
                  
      Offset 100:  08 10 10 10  00 00 00 00  33 00 00 00  07 00 00 00 
      Offset 110:  E8 20 84 87  22 78 80 02  FF 03 00 00  FF 01 FF 03 
      Offset 120:  05 2A 00 40  00 05 00 80  F0 01 00 00  00 00 00 00 
      Offset 130:  C4 06 00 00  6D 06 1A 87  01 02 08 10  00 00 00 00 
      Offset 140:  00 00 00 00  00 00 00 00  00 00 00 00  00 00 00 00 
      Offset 150:  00 00 00 00  00 00 00 00  00 00 00 00  00 00 00 00 
      Offset 160:  00 00 00 00  20 00 00 00  55 AA 00 22  98 87 22 20 
      Offset 170:  00 00 00 00  00 00 00 00  00 00 00 00  00 00 00 00 
      Offset 180:  10 10 10 10  00 00 00 00  00 00 00 00  00 00 00 00 
      Offset 190:  E8 20 84 87  22 78 80 02  FF 03 00 00  FF 01 FF 03 
      Offset 1A0:  05 2A 00 40  00 00 00 00  00 00 00 00  00 00 00 00 

    PCI-8086-2580:  Intel i915/925/945/955/E7221/E7230 MMR
                  
      Offset C00:  21 00 00 00  01 01 01 01  00 00 00 00  00 00 00 00 
      Offset C10:  00 00 00 00  03 00 80 00  00 00 00 00  00 00 00 00 
      Offset C20:  00 00 00 00  00 00 00 00  00 00 00 00  00 00 00 00 
      Offset C30:  01 00 00 00  00 00 00 00  00 00 00 00  00 00 00 00 
      Offset C40:  00 00 00 00  00 00 00 00  00 00 00 00  00 00 00 00 
      Offset C50:  00 00 00 00  00 00 00 00  00 00 00 00  00 00 00 00 
      Offset C60:  00 00 00 00  00 00 00 00  00 00 00 00  00 00 00 00 
      Offset C70:  00 00 00 00  00 00 00 00  00 00 00 00  00 00 00 00 
      Offset C80:  00 00 00 00  00 00 00 00  00 00 00 00  00 00 00 00 
      Offset C90:  00 00 00 00  00 00 00 00  00 00 00 00  00 00 00 00 
      Offset CA0:  00 00 00 00  00 00 00 00  00 00 00 00  00 00 00 00 
      Offset CB0:  00 00 00 00  00 00 00 00  00 00 00 00  00 00 00 00 
      Offset CC0:  00 00 00 00  00 00 00 00  00 00 00 00  00 00 00 00 
      Offset CD0:  01 01 01 01  00 00 00 00  01 00 00 FF  00 00 00 00 
      Offset CE0:  00 00 00 00  00 00 80 00  00 00 00 00  00 00 00 00 
      Offset CF0:  00 00 00 00  00 00 00 00  00 00 00 00  00 00 00 00 


--------[ Debug - Video BIOS ]------------------------------------------------------------------------------------------

    C000:0000  U.w.K7400.L.w.VIDEO ......]...IBM VGA Compatible......p.10/26/04
    C000:0040  ....................X.$1?@/|...........".........PMIDl.o.......
    C000:0080  .....3.MC...X.$1....C.......PCIR..A.........w.......NX66128DP F1
    C000:00C0  ................................................................
    C000:0100  .....Version 5.43.02.16.00 ....Copyright (C) 1996-2004 NVIDIA Co
    C000:0140  rp.....................................................$GV.GV-NX
    C000:0180  661F..E.../........N`..28DP    ...............................YG
    C000:01C0  F 6600                                                          
    C000:0200          ........X.....\.......nv43 Board - p229h3  .............
    C000:0240  .Chip Rev   ............BIT......H2.....B.....C.....D.....I.....
    C000:0280  L.....M.....N.....P.....S.....T...#.U...%.V...(.c.....i.#.......
    C000:02C0  ..C.........00/00/00.........8\X/.\.....].].].].].].]n..^r......
    C000:0300  .'...7.......B..P.....(./.!/#..#A.....\.e5H5....C..`.3....Cy]09/
    C000:0340  01/04.............1.(...A.(.(.c...c...I.(.........x.......\.....
    C000:0380  (.c.(...(.Z.(.f.(.(.(...a.(....Xe.f.`.`.`.......`.n.R...q.`.`.t.
    C000:03C0  ,.1.(.x.R...r.f`....]................u..fa....f`3....fa....C.>..


--------[ Debug - Unknown ]---------------------------------------------------------------------------------------------

    PCI/AGP         Broadcom NetLink (TM) Gigabit Ethernet [NoDB]


------------------------------------------------------------------------------------------------------------------------

The names of actual companies and products mentioned herein may be the trademarks of their respective owners.
